names,province,addresses,counts,points天台山风景区,四川,四川省成都邛崃市天台镇,74,"103.112093,30.287431"
锦里,四川,四川省成都市武侯区武侯祠大街231号,36,"104.056424,30.651723"
川南大草原,四川,四川省内江市市中区永安镇内荣路,340,"104.932028,29.525043"
曾家山,四川,四川省广元市朝天区曾家山民俗文化广场,8,"106.112876,32.632199"
紫颐香薰山谷,四川,四川省成都市双流县龙泉驿区太平镇双简路紫颐香薰山谷景区,54,"104.187816,30.441917"
蒙顶山,四川,四川省雅安市名山县蒙顶山,290,"103.051212,30.078976"
巨型睡佛,四川,四川省乐山市市中区凌云路2435号簏子街乐山大佛景区内,814,"103.77941971961,29.547182243914"
墨石公园,四川,四川省甘孜州道孚县八美镇卡玛村与中古村交界处,342,"101.541881,30.445199"
绵阳方特东方神画,四川,绵阳市江油市方特大道1号,1202,"104.714187,31.734952"
瓦屋山,四川,四川省眉山市洪雅县瓦屋山镇,372,"102.998884,29.684073"
玉垒阁,四川,四川省成都市都江堰市城西公园路都江堰风景名胜区内,84,"103.621165,31.007551"
百里杜鹃,贵州,贵州省毕节市黔西县普底乡,8688,"105.941117,27.18131"
西江千户苗寨,贵州,贵州省凯里市黔东南苗族侗族自治州雷山县西江镇南贵村,2756,"108.18029,26.500009"
梵净山,贵州,中国贵州铜仁市江口县太平乡黑湾河梵净山景区,1530,"108.781453,27.849178"
黄果树瀑布,贵州,贵州省安顺镇宁布依族苗族自治县黄果树瀑布,1324,"105.67645,25.994852"
小七孔景区,贵州,贵州省黔南州荔波县,1450,"107.723691,25.262515"
青岩古镇,贵州,贵阳市花溪区交通路240号,1086,"106.695326,26.339051"
织金洞,贵州,贵州省毕节市织金县官寨乡织金洞景区,942,"105.902441,26.770667"
黄果树风景名胜区,贵州,贵州省安顺镇宁布依族苗族自治县黄果树风景名胜区,166,"105.673786,25.987789"
天河潭旅游度假区,贵州,贵州省贵阳市花溪区石板镇天河潭风景区,362,"106.586422,26.44822"
天星桥,贵州,贵州省安顺市关岭县,466,"105.686279,25.95361"
龙宫,贵州,贵州省安顺市镇宁县龙宫镇,308,"105.895189,26.098328"
万峰林,贵州,贵州省黔西南州兴义市万峰林街道,200,"104.929696,25.009011"
仙人街景区,贵州,铜仁市石阡县龙井乡关口坪村满家寨,108,"108.171216,27.54055"
乌蒙大草原,贵州,贵州六盘水市盘县北部,458,"104.624584,26.12163"
石阡温泉群,贵州,贵州省铜仁市石阡县汤山镇,22,"108.233289,27.517876"
赤水丹霞旅游区·大瀑布,贵州,贵州省遵义市赤水市两河口乡,58,"105.752971,28.381778"
土城古镇,贵州,贵州省遵义市习水县土城镇,830,"106.012501,28.278971"
森哒星生态度假公园,贵州,贵州贵安新区黔中路与北斗湖之路交汇处云漫湖国际旅游休闲度假区内,234,"106.443937,26.378834"
西江苗族博物馆,贵州,贵州省凯里市黔东南苗族侗族自治州雷山县西江镇南贵村西江千户苗寨景区内,42,"108.181193,26.49871"
多彩贵州城极地海洋世界,贵州,贵州省贵阳市南明区龙洞堡多彩贵州城,354,"106.79701,26.53569"
黔灵公园,贵州,贵州省贵阳市云岩区枣山路187号,48,"106.700343,26.60699"
云门囤,贵州,贵州省遵义市遵义县团堡村,138,"107.288176,27.652213"
中国天眼科普基地,贵州,黔南布依族苗族自治州平塘县航龙未来国际天文小镇天眼景区,352,"106.897045,25.700488"
马岭河峡谷,贵州,贵州省黔西南兴义城东北6公里,206,"104.96085,25.13558"
肇兴侗寨,贵州,贵州省黔东南苗族侗族自治州黎平县,288,"109.18580998873,25.912916208406"
朱砂古镇（万山国家矿山公园）,贵州,铜仁市万山区万山镇土坪社区,44,"109.230977,27.536149"
水湄花谷,贵州,遵义市湄潭县洗马镇县道360旁,34,"107.495736,27.931265"
百花渡花卉主题文化园,贵州,贵州省铜仁市碧江区X500,8,"109.285872,27.737798"
猴耳天坑风景区,贵州,贵州省贵阳市开阳县城关镇石头村桃子窝,32,"107.013912,27.091371"
南江大峡谷,贵州,贵州省贵阳市开阳县南江乡龙广村,30,"106.97722,26.946803"
贵御温泉旅游区,贵州,贵州省贵阳市乌当区温泉路555号,10,"106.777159,26.622163"
双龙镇巫山峡谷,贵州,贵州省黔南市龙里县和贵阳龙洞堡交界处,28,"106.800977,26.513508"
亚木沟,贵州,贵州省铜仁地区江口县,132,"108.745863,27.789301"
息烽温泉,贵州,贵州省贵阳市息烽县城东北40千米处,94,"106.862949,27.212028"
大七孔景区,贵州,贵州省黔南州荔波县大七孔景区,388,"107.760251,25.287526"
思达遵义游乐园,贵州,贵州遵义市红花岗区湘江大道遵义国际商贸城展示中心对面,56,"106.921523,27.63089"
石阡古温泉水上乐园,贵州,贵州省铜仁市石阡县汤山镇温泉社区,64,"108.234379,27.518316"
兴义市吉隆堡度假村,贵州,黔西南布依族苗族自治州兴义市万峰湖吉隆堡度假村,22,"105.024288,24.925096"
夜郎洞,贵州,贵州省镇宁县黄果树风景区上游扁担山,32,"105.635467,26.094013"
剑河温泉城,贵州,贵州省黔东南凯里市,54,"108.500768,26.773715"
黔南鸳鸯湖,贵州,贵州省黔南布依族苗族自治州荔波县,250,"107.692112,25.254609"
九洞天,贵州,贵州省毕节市,184,"105.289445,27.29413"
佛顶山温泉小镇,贵州,铜仁市石阡县中坝镇,34,"108.197108,27.464488"
金沙桂花温泉,贵州,贵州省毕节市金沙县桂花村桂花水乡,32,"106.424593,27.391498"
甲茶,贵州,贵州省黔南布依族苗族自治州平塘县,38,"107.207533,25.635078"
龙里大草原,贵州,贵州省黔南布依族苗族自治州龙里县草原乡,40,"106.891562,26.335588"
镇远,贵州,贵州省黔东南苗族侗族自治州镇远县顺城路镇远,16,"108.429895,27.055759"
梅花山索道,贵州,贵州省六盘水市钟山区双戛乡,44,"104.786616,26.619361"
海龙屯,贵州,遵义市遵义县高坪区太平乡白沙村,24,"106.92909695548,27.726613695122"
镇远青龙洞,贵州,贵州省黔东南苗族侗族自治州镇远县舞阳镇,98,"108.440226,27.055462"
四洞沟风景区,贵州,贵州省遵义赤水市赤水风景名胜区内,122,"105.654949,28.474733"
潜龙洞,贵州,贵州省铜仁市松桃县乌罗镇黔龙村,52,"108.850095,28.104937"
云溪汤泉,贵州,贵州省凯里市舟溪镇新光村云谷田园生态园,16,"107.939935,26.51187"
巫山峡谷旅游景区,贵州,黔南州龙里县双龙临空经济区中铁国际生态城云栖谷旁,4,"106.847496,26.485507"
陡坡塘瀑布,贵州,贵州省安顺市镇宁县黄果树镇黄果树瀑布上游1公里处,214,"105.679146,26.004002"
恐龙乐园,贵州,,52,"109.240377,27.763217"
汇川国际温泉城,贵州,贵州省遵义市汇川区汇川大道旁(红河北路与金沙江路交汇处),34,"106.947444,27.775288"
九天温泉,贵州,贵州省铜仁市思南县城北新区温泉大道1号,46,"108.259574,27.975423"
遵义海洋世界,贵州,贵州遵义汇川区温州路自游港·奥特莱斯广场B区L3,32,"106.911028,27.702731"
镇远铁溪,贵州,贵州省黔东南州镇远县城区东北4公里处,14,"108.448675,27.059261"
下司古镇,贵州,贵州省黔东南苗族侗族自治州麻江县下司镇内,70,"107.81043161073,26.52156702558"
红果树风景区,贵州,贵州省遵义市绥阳县大路槽乡,92,"107.299599,28.010285"
镇远石屏山,贵州,贵州省黔东南州镇远县舞阳镇舞阳河东侧,18,"108.325675,27.064424"
双乳峰景区,贵州,贵州省黔西南布依族苗族自治州贞丰县者相镇双乳峰风景区,36,"105.656499,25.492689"
四季贵州山地温泉水世界,贵州,贵阳市清镇市百马大道与清州大道交汇处,136,"106.469883,26.56421"
山里江南旅游休闲度假区,贵州,安顺市西秀区旧州镇东环路,64,"106.152197,26.257939"
龙里水乡旅游生态城,贵州,贵州省龙里县龙里水乡旅游生态城,176,"106.926583,26.445429"
神泉谷休闲旅游度假区,贵州,黔南布依族苗族自治州长顺县威远社区永增村,18,"106.51731,26.034344"
红云金顶,贵州,贵州省铜仁地区印江土家族苗族自治县 梵净山国家级自然保护区,66,"108.62114121107,27.946472500349"
丹寨万达小镇,贵州,黔东南苗族侗族自治州丹寨县东湖附近,10,"107.813295,26.204159"
美丽西江大型情景演出,贵州,贵州省凯里市西江千户苗寨,24,"107.985353,26.583989"
都匀秦汉影视城,贵州,黔南布依族苗族自治州都匀市都凯大道,88,"107.624281,26.247328"
红水河景区,贵州,贵州省黔南州罗甸县红水河镇,14,"106.628207,25.174788"
舞阳河,贵州,贵州省黔东南镇远镇远县,64,"108.475921,27.121609"
黔贵六广温泉,贵州,贵阳市修文县六广镇驿泉村阳明码头,14,"106.446342,27.00964"
七彩云南欢乐世界,云南,云南省昆明市晋宁区晋城镇,11725,"102.759278,24.712651"
云南民族村,云南,云南省昆明市西山区滇池路1310号,3218,"102.669319,24.971676"
景洪曼听公园,云南,云南省西双版纳傣族自治州景洪市曼听路35号,2192,"100.814267,21.998503"
玉龙雪山,云南,云南省丽江市玉龙纳西族自治县,1630,"100.270093,27.034011"
中科院西双版纳热带植物园,云南,云南省西双版纳州勐腊县勐仑镇(近野象谷),1576,"101.260734,21.933968"
束河茶马古道,云南,丽江市古城区束河街道,22,"100.213702,26.92433"
野象谷,云南,云南省西双版纳傣族自治州景洪市勐养镇三岔河,1442,"100.865759,22.175621"
西双版纳原始森林公园,云南,云南省西双版纳傣族自治州距景洪市8公里处213国道旁,1228,"100.881258,22.033038"
崇圣寺三塔,云南,云南省大理市大理古城西北两公里的苍山应乐峰下,1096,"100.149535,25.710163"
泸沽湖,云南,云南丽江市宁蒗彝族自治县东北部永宁乡,480,"100.799558,27.668458"
青鱼湾水上乐园,云南,云南省昆明市海口镇小海口收费站右转2公里处,1012,"102.54549,24.851305"
苍山国家地质公园,云南,云南省大理白族自治州大理市漾濞彝族自治县,530,"100.175674,25.650175"
滇池索道,云南,云南省昆明市滇池旅游度假区湖滨路16号,244,"102.658903,24.965776"
丽江古城,云南,云南省丽江市玉龙纳西族自治县东大街1号,182,"100.240547,26.881159"
石林,云南,云南省昆明市石林彝族自治县境内,244,"103.332585,24.823046"
九乡风景名胜区,云南,云南省昆明市宜良县九乡风景名胜区,478,"103.390531,25.073926"
蓝月谷,云南,云南省丽江市玉龙纳西族自治县15公里处玉龙雪山国家级风景名胜区内,114,"100.251243,27.131616"
昆明世界园艺博览园,云南,昆明市盘龙区白龙路439号,14,"102.762314,25.077786"
傣族园,云南,云南省西双版纳市景洪市勐罕镇橄榄坝,514,"100.954223,21.855821"
普达措国家公园,云南,云南省迪庆藏族自治州香格里拉县建塘镇双桥,72,"99.91451,27.807468"
鸡足山,云南,云南省大理州宾川县以西约30公里处,610,"100.400433,25.958131"
洱海,云南,云南省大理市下关洱河南路1号,118,"100.262195,25.610132"
噶丹松赞林寺,云南,云南省迪庆藏族自治州香格里拉县尼旺路下段,450,"99.712056,27.86626"
武定狮子山,云南,云南省楚雄彝族自治州武定县,124,"102.385484,25.539995"
腾冲热海旅游区,云南,云南省保山市腾冲县离县城10公里,78,"98.449373,24.955378"
望天树景区,云南,云南省勐腊县西双版纳热带雨林国家公园望天树景区,256,"101.594904,21.625925"
昆明西山龙门景区,云南,云南省昆明市西山区西山公路,308,"102.640355,24.964658"
普者黑,云南,云南省文山壮族苗族自治州丘北县城西13公里,180,"104.13577,24.123152"
丽江虎跳峡,云南,云南省丽江市玉龙县龙蟠乡,28,"100.105549,27.178554"
云南野生动物园,云南,云南省昆明市盘龙区穿金路,496,"102.795122,25.101678"
南诏风情岛,云南,云南省大理白族自治州洱源县环海路双廊镇,310,"100.198355,25.907885"
丽江千古情景区,云南,云南省丽江市玉龙县玉兴西路,682,"100.226381,26.834458"
环洱海旅拍,云南,云南省大理白族自治州大理市洱海环线,10,"100.272671,25.649292"
西双版纳勐泐文化旅游区,云南,云南省西双版纳州景洪市勐泐大道顶端4路1号,264,"100.81375519985,21.969540244135"
拉市海,云南,云南省丽江市玉龙县拉市海湿地公园,302,"100.145593,26.896784"
大益庄园,云南,云南省西双版纳勐海县云南农业科学院茶叶研究所茶山之中,20,"100.437668,21.990271"
西双版纳热带花卉园,云南,云南省西双版纳傣族自治州景洪市宣慰大道99号,194,"100.794184,22.016914"
昆明花都海洋世界,云南,云南省昆明市呈贡区斗南花花世界,376,"102.787514,24.901387"
世界恐龙谷旅游区,云南,云南省楚雄彝族自治州禄丰县世界恐龙谷风景旅游区,92,"102.078072,24.975647"
花之城,云南,云南省昆明市盘龙区金瓦路8188号,86,"102.795125,25.059343"
云花谷,云南,昆明市五华区西翥街道三多大村,226,"102.699297,25.195885"
蝴蝶泉,云南,云南省大理白族自治州苍山云弄峰下,90,"100.108928,25.913304"
弥勒湖泉酒店半山温泉,云南,云南红河弥勒湖泉酒店半山温泉中心售票处（E座旁边）,82,"103.410428,24.409664"
七彩云南古滇温泉山庄,云南,云南省昆明市晋宁县晋城镇新街片区三合村委会,390,"102.762433,24.774281"
苍山洗马潭索道,云南,云南省大理白族自治州大理市苍山景区下三月街天龙八部影视城内,196,"100.154462,25.686735"
大观楼,云南,云南省昆明市西山区大观路72号,90,"102.680412,25.030081"
观音峡,云南,云南省丽江市东南17公里处的七河乡,70,"100.276078,26.766885"
滇池,云南,云南省昆明市西山区滇池路1318号,94,"102.671688,24.966221"
昆明西游洞,云南,云南省昆明市五华区昆禄公路6公里处,254,"102.648809,25.147944"
香格里拉大峡谷巴拉格宗,云南,云南省迪庆藏族自治州香格里拉县尼西乡幸福村巴拉社,82,"99.441422,28.291985"
昆明金殿风景名胜区,云南,云南省昆明市盘龙区鸣凤山上穿金路,96,"102.77558,25.089211"
普陀泉SPA温泉度假村,云南,云南大理白族自治州洱源县右所镇下山口,42,"100.039535,26.079403"
西部大峡谷温泉,云南,云南省昭通市水富县金沙江畔,320,"104.377061,28.644863"
大理古城,云南,云南大理市下关,124,"100.170462,25.693527"
昆明动物园,云南,云南省昆明市五华区青年路北段的圆通山,362,"102.716251,25.060346"
坝美景区,云南,云南省文山壮族苗族自治州广南县,182,"105.047666,24.319947"
阿庐古洞,云南,云南红河哈尼族彝族自治州泸西县中枢镇泸源洞村,46,"103.760294,24.563245"
映月潭温泉,云南,云南省玉溪市红塔区大营街公园路95号,18,"102.500039,24.347663"
朱家花园,云南,云南省红河州建水县翰林街16号,206,"102.833826,23.622492"
大理苍山石门关景区,云南,云南省大理州漾濞县苍山西镇金牛村石门关景区,22,"100.040996,25.643214"
大观楼,云南,云南省昆明市西山区大观路72号,90,"102.680412,25.030081"
观音峡,云南,云南省丽江市东南17公里处的七河乡,70,"100.276078,26.766885"
滇池,云南,云南省昆明市西山区滇池路1318号,94,"102.671688,24.966221"
昆明西游洞,云南,云南省昆明市五华区昆禄公路6公里处,254,"102.648809,25.147944"
香格里拉大峡谷巴拉格宗,云南,云南省迪庆藏族自治州香格里拉县尼西乡幸福村巴拉社,82,"99.441422,28.291985"
昆明金殿风景名胜区,云南,云南省昆明市盘龙区鸣凤山上穿金路,96,"102.77558,25.089211"
普陀泉SPA温泉度假村,云南,云南大理白族自治州洱源县右所镇下山口,42,"100.039535,26.079403"
西部大峡谷温泉,云南,云南省昭通市水富县金沙江畔,320,"104.377061,28.644863"
大理古城,云南,云南大理市下关,124,"100.170462,25.693527"
昆明动物园,云南,云南省昆明市五华区青年路北段的圆通山,362,"102.716251,25.060346"
坝美景区,云南,云南省文山壮族苗族自治州广南县,182,"105.047666,24.319947"
阿庐古洞,云南,云南红河哈尼族彝族自治州泸西县中枢镇泸源洞村,46,"103.760294,24.563245"
映月潭温泉,云南,云南省玉溪市红塔区大营街公园路95号,18,"102.500039,24.347663"
朱家花园,云南,云南省红河州建水县翰林街16号,206,"102.833826,23.622492"
大理苍山石门关景区,云南,云南省大理州漾濞县苍山西镇金牛村石门关景区,22,"100.040996,25.643214"
布达拉宫,西藏,西藏自治区拉萨市城关区北京中路35号,1696,"91.125491,29.660076"
大昭寺,西藏,西藏拉萨市城关区中心八角街,302,"91.140356,29.65617"
巴松措,西藏,西藏自治区林芝地区工布江达县,164,"93.869055,29.988577"
纳木错,西藏,西藏拉萨当雄县和那曲地区班戈县之间,254,"90.875089,30.780115"
羊卓雍措,西藏,西藏自治区山南市,184,"90.808843,28.954092"
《文成公主》,西藏,西藏拉萨市城关区慈觉林（原次角林）中国西藏文化旅游创意园,138,"91.151802,29.631162"
白塔,西藏,西藏自治区拉萨市城关区北京中路,34,"91.121995,29.658415"
卡若拉冰川,西藏,西藏日喀则江孜县卡若拉山口,48,"90.172386,28.901847"
羊八井温泉,西藏,西藏自治区拉萨市当雄县羊八井镇,250,"90.491247,30.084296"
南迦巴瓦峰,西藏,西藏自治区林芝县西藏林,18,"94.882068,29.512075"
雅鲁藏布大峡谷,西藏,西藏省林芝地区米林县雅鲁藏布大峡谷风景区,160,"94.888588,29.517885"
卡定沟天佛瀑布,西藏,西藏林芝市林芝县卡定沟景区内,4,"94.073491,29.734593"
拉萨河,西藏,西藏拉萨市城关区,4,"91.233863,29.659265"
念青唐古拉观景台,西藏,拉萨市当雄县念青唐古拉山,28,"90.815513,30.533791"
扎西半岛,西藏,西藏藏族自治区拉萨市当雄县,10,"90.890102,30.778141"
念青唐古拉山,西藏,西藏拉萨市当雄县,16,"90.566551,30.392642"
廓琼岗日冰川,西藏,拉萨市当雄县格达乡S304省道旁,12,"90.3327,29.972178"
纳木错圣象天门,西藏,西藏那曲地区班戈县青龙乡5村境内,26,"90.878496,30.778904"
雅尼湿地景区,西藏,西藏自治区林芝市巴宜区八一镇附近,6,"94.366815,29.645155"
珠峰大本营,西藏,西藏日喀则地区定日县,4,"86.849177,28.171423"
卡定沟,西藏,西藏自治区林芝市巴宜区八一镇卡定沟,20,"94.176626,29.759486"
古格王国遗址,西藏,西藏阿里市扎达县札布让区象泉河畔,4,"79.678683,31.468751"
岗巴拉山口,西藏,山南市浪卡子县与贡嘎县界山,4,"90.625883,29.197019"
尼洋河风光带景区,西藏,西藏林芝地区林芝县达则村,47,"94.013713,29.764153"
鲁朗花海牧场景区,西藏,西藏林芝地区林芝县鲁朗镇,59,"94.736741,29.705572"
扎什伦布寺,西藏,西藏日喀则市几吉郎卡路1号,2,"88.879118,29.269685"
雅鲁藏布江,西藏,西藏自治区,16,"95.192328340688,29.898720453451"
珠穆朗玛峰,西藏,西藏日喀则定日县正南方,4,"86.923597,27.985823"
罗布林卡,西藏,拉萨市罗布林卡路21号,70,"91.102232,29.65577"
鲁朗风景区,西藏,西藏省林芝地区林芝县,54,"94.747806,29.76381"
念青唐古拉山,西藏,西藏拉萨市当雄县,16,"90.566551,30.392642"
廓琼岗日冰川,西藏,拉萨市当雄县格达乡S304省道旁,12,"90.3327,29.972178"
纳木错圣象天门,西藏,西藏那曲地区班戈县青龙乡5村境内,26,"90.878496,30.778904"
雅尼湿地景区,西藏,西藏自治区林芝市巴宜区八一镇附近,6,"94.366815,29.645155"
珠峰大本营,西藏,西藏日喀则地区定日县,4,"86.849177,28.171423"
卡定沟,西藏,西藏自治区林芝市巴宜区八一镇卡定沟,20,"94.176626,29.759486"
古格王国遗址,西藏,西藏阿里市扎达县札布让区象泉河畔,4,"79.678683,31.468751"
岗巴拉山口,西藏,山南市浪卡子县与贡嘎县界山,4,"90.625883,29.197019"
尼洋河风光带景区,西藏,西藏林芝地区林芝县达则村,47,"94.013713,29.764153"
鲁朗花海牧场景区,西藏,西藏林芝地区林芝县鲁朗镇,59,"94.736741,29.705572"
扎什伦布寺,西藏,西藏日喀则市几吉郎卡路1号,2,"88.879118,29.269685"
雅鲁藏布江,西藏,西藏自治区,16,"95.192328340688,29.898720453451"
珠穆朗玛峰,西藏,西藏日喀则定日县正南方,4,"86.923597,27.985823"
罗布林卡,西藏,拉萨市罗布林卡路21号,70,"91.102232,29.65577"
鲁朗风景区,西藏,西藏省林芝地区林芝县,54,"94.747806,29.76381"
念青唐古拉山,西藏,西藏拉萨市当雄县,16,"90.566551,30.392642"
廓琼岗日冰川,西藏,拉萨市当雄县格达乡S304省道旁,12,"90.3327,29.972178"
纳木错圣象天门,西藏,西藏那曲地区班戈县青龙乡5村境内,26,"90.878496,30.778904"
雅尼湿地景区,西藏,西藏自治区林芝市巴宜区八一镇附近,6,"94.366815,29.645155"
珠峰大本营,西藏,西藏日喀则地区定日县,4,"86.849177,28.171423"
卡定沟,西藏,西藏自治区林芝市巴宜区八一镇卡定沟,20,"94.176626,29.759486"
古格王国遗址,西藏,西藏阿里市扎达县札布让区象泉河畔,4,"79.678683,31.468751"
岗巴拉山口,西藏,山南市浪卡子县与贡嘎县界山,4,"90.625883,29.197019"
尼洋河风光带景区,西藏,西藏林芝地区林芝县达则村,47,"94.013713,29.764153"
鲁朗花海牧场景区,西藏,西藏林芝地区林芝县鲁朗镇,59,"94.736741,29.705572"
扎什伦布寺,西藏,西藏日喀则市几吉郎卡路1号,2,"88.879118,29.269685"
雅鲁藏布江,西藏,西藏自治区,16,"95.192328340688,29.898720453451"
珠穆朗玛峰,西藏,西藏日喀则定日县正南方,4,"86.923597,27.985823"
罗布林卡,西藏,拉萨市罗布林卡路21号,70,"91.102232,29.65577"
鲁朗风景区,西藏,西藏省林芝地区林芝县,54,"94.747806,29.76381"
念青唐古拉山,西藏,西藏拉萨市当雄县,16,"90.566551,30.392642"
廓琼岗日冰川,西藏,拉萨市当雄县格达乡S304省道旁,12,"90.3327,29.972178"
纳木错圣象天门,西藏,西藏那曲地区班戈县青龙乡5村境内,26,"90.878496,30.778904"
雅尼湿地景区,西藏,西藏自治区林芝市巴宜区八一镇附近,6,"94.366815,29.645155"
珠峰大本营,西藏,西藏日喀则地区定日县,4,"86.849177,28.171423"
卡定沟,西藏,西藏自治区林芝市巴宜区八一镇卡定沟,20,"94.176626,29.759486"
古格王国遗址,西藏,西藏阿里市扎达县札布让区象泉河畔,4,"79.678683,31.468751"
岗巴拉山口,西藏,山南市浪卡子县与贡嘎县界山,4,"90.625883,29.197019"
尼洋河风光带景区,西藏,西藏林芝地区林芝县达则村,47,"94.013713,29.764153"
鲁朗花海牧场景区,西藏,西藏林芝地区林芝县鲁朗镇,59,"94.736741,29.705572"
扎什伦布寺,西藏,西藏日喀则市几吉郎卡路1号,2,"88.879118,29.269685"
雅鲁藏布江,西藏,西藏自治区,16,"95.192328340688,29.898720453451"
珠穆朗玛峰,西藏,西藏日喀则定日县正南方,4,"86.923597,27.985823"
罗布林卡,西藏,拉萨市罗布林卡路21号,70,"91.102232,29.65577"
鲁朗风景区,西藏,西藏省林芝地区林芝县,54,"94.747806,29.76381"
念青唐古拉山,陕西,西藏拉萨市当雄县,16,"90.566551,30.392642"
廓琼岗日冰川,陕西,拉萨市当雄县格达乡S304省道旁,12,"90.3327,29.972178"
纳木错圣象天门,陕西,西藏那曲地区班戈县青龙乡5村境内,26,"90.878496,30.778904"
雅尼湿地景区,陕西,西藏自治区林芝市巴宜区八一镇附近,6,"94.366815,29.645155"
珠峰大本营,陕西,西藏日喀则地区定日县,4,"86.849177,28.171423"
卡定沟,陕西,西藏自治区林芝市巴宜区八一镇卡定沟,20,"94.176626,29.759486"
古格王国遗址,陕西,西藏阿里市扎达县札布让区象泉河畔,4,"79.678683,31.468751"
岗巴拉山口,陕西,山南市浪卡子县与贡嘎县界山,4,"90.625883,29.197019"
尼洋河风光带景区,陕西,西藏林芝地区林芝县达则村,47,"94.013713,29.764153"
鲁朗花海牧场景区,陕西,西藏林芝地区林芝县鲁朗镇,59,"94.736741,29.705572"
扎什伦布寺,陕西,西藏日喀则市几吉郎卡路1号,2,"88.879118,29.269685"
雅鲁藏布江,陕西,西藏自治区,16,"95.192328340688,29.898720453451"
珠穆朗玛峰,陕西,西藏日喀则定日县正南方,4,"86.923597,27.985823"
罗布林卡,陕西,拉萨市罗布林卡路21号,70,"91.102232,29.65577"
鲁朗风景区,陕西,西藏省林芝地区林芝县,54,"94.747806,29.76381"
念青唐古拉山,陕西,西藏拉萨市当雄县,16,"90.566551,30.392642"
廓琼岗日冰川,陕西,拉萨市当雄县格达乡S304省道旁,12,"90.3327,29.972178"
纳木错圣象天门,陕西,西藏那曲地区班戈县青龙乡5村境内,26,"90.878496,30.778904"
雅尼湿地景区,陕西,西藏自治区林芝市巴宜区八一镇附近,6,"94.366815,29.645155"
珠峰大本营,陕西,西藏日喀则地区定日县,4,"86.849177,28.171423"
卡定沟,陕西,西藏自治区林芝市巴宜区八一镇卡定沟,20,"94.176626,29.759486"
古格王国遗址,陕西,西藏阿里市扎达县札布让区象泉河畔,4,"79.678683,31.468751"
岗巴拉山口,陕西,山南市浪卡子县与贡嘎县界山,4,"90.625883,29.197019"
尼洋河风光带景区,陕西,西藏林芝地区林芝县达则村,47,"94.013713,29.764153"
