names,province,addresses,counts,points三清山,江西,江西省上饶市玉山县,832,"118.075981,28.915377"
梅岭景区,江西,江西省南昌市西郊30公里处,116,"115.745284,28.803352"
赣州石城八卦脑,江西,江西省赣州市石城县高田镇新坪村,128,"116.488639,26.50797"
庐山风景名胜区,江西,江西省九江市庐山区,360,"116.001261,29.561078"
安义斐然生态园,江西,江西省南昌市安义县长均乡观察村,6,"115.742854,28.849905"
滕王阁,江西,江西省南昌市东湖区仿古街58号,534,"115.888564,28.686101"
凤凰沟,江西,江西省南昌市南昌县黄马乡凤凰沟（自驾320国道修路，到银三角上桥，然后从昌南上高速，往上海方向走一段高速，从黄马下）,338,"116.018207,28.374381"
明月山,江西,江西省宜春市袁州区温汤镇,256,"114.299102,27.60543"
龙虎山,江西,江西省鹰潭市西南20公里处贵溪市境内,480,"116.999461,28.090447"
龟峰风景名胜区,江西,江西省上饶市弋阳县方志敏大道,20,"117.4075,28.323867"
仙凤三宝,江西,江西萍乡市芦溪县宣风镇竹垣村,116,"114.179158,27.722726"
西海湾景区,江西,江西省九江市武宁县朝阳湖东路11号,6,"115.501065,29.198955"
葛仙山,江西,江西省上饶市铅山县杨林乡,370,"117.7123,28.064453"
南昌融创乐园,江西,江西省南昌市九龙湖新区南龙蟠街888号,66,"115.792634,28.583925"
井冈山,江西,江西省吉安井冈山市茨坪镇,106,"114.172394,26.576456"
梅岭太阳谷,江西,江西省南昌市湾里区梅岭太阳坑（梅岭银杏生态园旁）,108,"115.797052,28.782261"
柘林湖,江西,江西省九江市永修县柘林湖,94,"115.479414,29.200984"
明月山天沐温泉,江西,江西省宜春市袁州区温汤镇温泉路17号,198,"114.288588,27.698216"
江湾,江西,江西省上饶市婺源县江湾镇,78,"118.058037,29.373708"
南武当景区,江西,江西省赣州市龙南县武当镇,116,"114.720841,24.615032"
九龙溪生态休闲公园,江西,江西省南昌市湾里区太平镇心街,28,"115.728573,28.806537"
浮梁古县衙,江西,江西省景德镇浮梁县浮梁古县衙景区,256,"117.257663,29.373252"
宜春花博园,江西,江西省宜春市袁州区湖田镇湖田村,28,"114.435237,27.804496"
瑶里,江西,江西省景德镇市浮梁县087县道瑶里风景区,186,"117.588075,29.547307"
安义古村,江西,江西省南昌市安义县石彼镇罗田村,144,"115.612762,28.754027"
怪石岭,江西,江西省南昌市新建县溪霞镇,16,"115.830576,28.864034"
天香园,江西,江西省南昌市青山湖南大道333号,92,"115.962689,28.659998"
大觉山,江西,江西省抚州市资溪县建设路60号,26,"117.150848,27.702614"
虔心小镇,江西,江西省赣州市龙南县临塘乡东坑村,12,"114.842788,24.756436"
婺源江岭（油菜花）,江西,江西省上饶市婺源县溪头乡江岭梯田风光中心,118,"118.038311,29.46079"
通天寨景区,江西,江西省赣州市石城县琴江镇大畲村,6,"116.376198,26.283065"
丫山景区,江西,江西省赣州市大余县黄龙镇,30,"114.41356,25.469317"
鄱阳湖国家湿地公园,江西,江西省上饶市鄱阳县鄱阳湖景区,34,"116.687407,29.13607"
明月千古情,江西,江西省宜春市温汤镇千古情大道,174,"114.291853,27.68778"
庐山天沐温泉,江西,江西省九江市庐山区星子县温泉镇,30,"115.934177,29.422343"
思溪延村,江西,江西省上饶市婺源县思口镇思溪延村,88,"117.809973,29.345107"
神龙宫,江西,江西省上饶市万年县大源镇盘岭村,32,"117.262472,28.713106"
新余凯光植物园,江西,江西省新余市渝水区龙盘隧道出口凯光新天地,6,"114.87788,27.840478"
厚田沙漠,江西,江西省南昌市新建县厚田乡,18,"115.809483,28.443056"
阳明山(原阳岭森林公园),江西,江西省赣州市崇义县县城南郊,20,"114.320086,25.663301"
石钟山,江西,江西省九江市湖口县登山路22号,6,"116.230013,29.74883"
李坑,江西,江西省上饶市婺源县秋口镇李坑村,252,"117.936953,29.328547"
南昌海洋公园,江西,江西省南昌市青山湖区北京东路1984号,76,"115.983898,28.679323"
通天岩,江西,江西省赣州市章贡区水西镇黄沙村,26,"114.912057,25.92501"
江西直升机科技馆,江西,江西省景德镇市高新区直航路1号,26,"117.181079,29.271429"
梅岭竹海明珠,江西,江西省南昌市湾里区014县道,12,"115.745344,28.803107"
庐山险峰,江西,江西省九江市庐山区庐山景区内,20,"115.973504,29.572479"
望仙谷,江西,上饶市广信区望仙乡,138,"117.825577,28.685889"
梅岭狮子峰,江西,江西省南昌市湾里区店前以西4公里,50,"115.731969,28.814291"
明月山维景温泉,江西,江西省宜春市袁州区温汤镇,60,"114.291594,27.708867"
石门涧,江西,江西省九江市庐山区石门涧风景名胜区,16,"115.95312,29.568294"
灵山风景区,江西,江西省上饶市上饶县灵山风景名胜区,228,"117.838313,28.551653"
孽龙洞,江西,江西省萍乡市上栗县,26,"113.8745685967,27.776723966068"
汉汤温泉,江西,江西省南昌市洪都中大道湖坊镇顺外村02栋名人大酒楼东南方向,26,"115.934111,28.67689"
天柱峰,江西,江西省宜春市铜鼓县赣西北九岭山脉西麓大镇境内,86,"114.56192044348,28.652402096853"
三叠泉,江西,江西省九江市庐山三叠泉,198,"116.061737,29.54964"
梅岭紫清山,江西,江西省南昌市湾里区新建县梅岭镇紫清路西北方向尽头,14,"115.730229,28.733244"
铜源峡,江西,江西省南昌市新建区望城镇幸福村萧峰大道（幸福湖边）,10,"115.745362,28.737938"
汤里森林温泉旅游度假区,江西,江西省宜春市铜鼓县大塅镇隘口村,58,"114.548265,28.715753"
石崆寨旅游景区,江西,江西省赣州市寻乌县留车镇雁洋村石崆寨旅游景区售票处,12,"115.650899,24.703481"
烟水亭,江西,江西省九江市浔阳区,26,"115.992607,29.72854"
翠微峰,江西,江西省赣州市宁都县城西北郊3公里,10,"115.99595,26.51819"
秀峰,江西,江西省九江市庐山区庐山风景区内,86,"115.99518,29.474747"
武功山嵘源温泉,江西,江西省吉安市安福县泰山乡,22,"114.258647,27.500971"
矿疗温泉,江西,江西省宜春市明月山温泉风景名胜区温泉路179号,32,"114.30024,27.696265"
绿地中心303观光厅,江西,江西省南昌市红谷滩红谷中大道998号,42,"115.861564,28.69133"
东林大峡谷,江西,江西省九江市庐山区庐山风景区内,4,"115.979019,29.600338"
三翁花园,江西,江西省抚州市临川区玉茗大道,56,"116.220314,27.840659"
庐山恋影院,江西,江西省九江市庐山区庐山河西路19号,20,"115.991209,29.571663"
赣州极地海洋世界,江西,江西省赣州市章贡区水西赣州北出口向左500米(赣州极地海洋世界),80,"114.936005,25.917606"
南昌海昏侯国遗址公园,江西,江西省南昌市南昌汉代海昏侯国遗址公园紫金大道1号,102,"115.936402,29.032601"
曹州牡丹园,山东,山东省菏泽市牡丹区牡丹街,1228,"115.507426,35.283395"
千佛山,山东,山东省济南市历下区经十一路18号,2238,"117.041792,36.644733"
泰山,山东,山东省泰安市泰山区红门路54号,1184,"117.12107,36.247343"
大珠山,山东,山东省青岛胶南市滨海街道办事处石门寺,1512,"120.011847,35.803661"
青岛森林野生动物世界,山东,山东省青岛市黄岛区小珠山风景区,1776,"120.066014,35.988067"
金宝乐园,山东,山东潍坊市奎文区潍洲路438号,2442,"119.133498,36.661729"
台儿庄古城,山东,山东省枣庄市台儿庄区华兴路东段,678,"117.747047,34.563186"
中国牡丹园,山东,山东省菏泽市牡丹区G220国道中国牡丹园,60,"115.558432,35.314956"
青岛海底世界,山东,山东省青岛市市南区莱阳路2号,1284,"120.342061,36.062757"
西霞口神雕山野生动物园,山东,山东省威海市荣成市成山镇西霞口村东北处,1612,"122.638099,37.419708"
济南动物园,山东,山东省济南市天桥区济洛路87号,1130,"116.99318,36.708071"
泉城欧乐堡梦幻世界,山东,山东省德州市齐河县黄河国际生态城旅游路07号,972,"116.851086,36.749665"
趵突泉公园,山东,山东省济南市历下区趵突泉南路1号,594,"117.02264,36.667808"
济南野生动物世界,山东,山东省济南市章丘市埠村街道南侧的埠西村,1142,"117.476508,36.625313"
青岛西海岸生态观光园,山东,山东省青岛市黄岛区胶州湾东路3666号,322,"120.072105,35.923265"
曹州牡丹园,山东,山东省菏泽市牡丹区牡丹街,1228,"115.507426,35.283395"
千佛山,山东,山东省济南市历下区经十一路18号,2238,"117.041792,36.644733"
泰山,山东,山东省泰安市泰山区红门路54号,1184,"117.12107,36.247343"
大珠山,山东,山东省青岛胶南市滨海街道办事处石门寺,1512,"120.011847,35.803661"
青岛森林野生动物世界,山东,山东省青岛市黄岛区小珠山风景区,1776,"120.066014,35.988067"
金宝乐园,山东,山东潍坊市奎文区潍洲路438号,2442,"119.133498,36.661729"
台儿庄古城,山东,山东省枣庄市台儿庄区华兴路东段,678,"117.747047,34.563186"
中国牡丹园,山东,山东省菏泽市牡丹区G220国道中国牡丹园,60,"115.558432,35.314956"
青岛海底世界,山东,山东省青岛市市南区莱阳路2号,1284,"120.342061,36.062757"
西霞口神雕山野生动物园,山东,山东省威海市荣成市成山镇西霞口村东北处,1612,"122.638099,37.419708"
济南动物园,山东,山东省济南市天桥区济洛路87号,1130,"116.99318,36.708071"
泉城欧乐堡梦幻世界,山东,山东省德州市齐河县黄河国际生态城旅游路07号,972,"116.851086,36.749665"
趵突泉公园,山东,山东省济南市历下区趵突泉南路1号,594,"117.02264,36.667808"
济南野生动物世界,山东,山东省济南市章丘市埠村街道南侧的埠西村,1142,"117.476508,36.625313"
青岛西海岸生态观光园,山东,山东省青岛市黄岛区胶州湾东路3666号,322,"120.072105,35.923265"
长岛,山东,山东省烟台市长岛县长岛风景区,154,"120.732217,37.921039"
沂蒙山旅游区龟蒙景区,山东,山东省临沂市平邑县柏林镇蒙山旅游度假区（原平邑蒙山）,80,"117.845409,35.550827"
平邑九间棚旅游区,山东,山东省临沂市平邑县地方镇九间棚,138,"117.747743,35.302273"
羊山风景区,山东,山东省济宁市金乡县羊山镇,16,"116.25358278415,35.17835494"
青岛海昌极地海洋公园,山东,山东省青岛市崂山区东海东路60号,1586,"120.449481,36.07508"
青岛茶山景区,山东,山东省青岛平度市店子镇茶山风景区,138,"119.982099,36.941727"
济南方特东方神画,山东,济南市槐荫区吴家堡镇济齐路277号（西客站北侧）,338,"116.885221,36.709359"
泰安方特欢乐世界,山东,山东省泰安市泰山区东部新区明堂路北首,120,"117.200368,36.244725"
原山,山东,山东省淄博市博山区颜山公园路4号,20,"117.840417,36.488236"
信号山公园,山东,山东省青岛市市南区齐东路17号,196,"120.338223,36.072829"
大明湖,山东,山东省济南市历下区大明湖路271号,70,"117.029659,36.679466"
济南植物园,山东,山东省济南章丘市埠村街道办事处,186,"117.464803,36.622245"
沂蒙山旅游区沂山景区,山东,山东省潍坊市潍坊市临朐县沂山镇镇址南300米,74,"118.629211,36.217258"
沂蒙山云蒙景区(蒙山国家森林公园),山东,山东省临沂市蒙阴县城南18公里,44,"117.98073,35.565713"
曲阜尼山圣境景区,山东,济宁市曲阜尼山镇圣像路9号,472,"117.219223,35.518329"
泉城海洋极地世界,山东,山东省德州市齐河县黄河国际生态城旅游路8号,756,"116.846812,36.749159"
竹泉村,山东,山东省临沂市沂南县铜井镇竹泉村,218,"118.444301,35.653863"
五莲山,山东,山东省日照市五莲县文化路东首,26,"119.408896,35.692217"
宝山前野生动物园,山东,山东省临沂市兰陵县234省道宝山前风景区,294,"117.955848,34.941246"
蓬莱海洋极地世界,山东,山东省烟台市蓬莱市海港路88号,134,"120.752548,37.831253"
地下大峡谷,山东,山东省临沂市沂水县姚店子镇永富庄,278,"118.552734,35.731915"
八仙过海景区,山东,山东省烟台蓬莱市海滨路东8号,114,"120.782222,37.831631"
天上王城,山东,山东省临沂市沂水县沂蒙山腹地的沂水县城西北40公里处,166,"118.371203,35.957777"
青州古城,山东,山东省潍坊市青州古城,68,"118.485248,36.690079"
鲁商新泰新甫山,山东,山东省泰安新泰市迈莱河路北首与莲花路交接处,10,"117.642377,35.97921"
天下第一泉风景区,山东,山东省济南市明湖路271号,66,"117.022975,36.678402"
沂蒙山银座天蒙旅游区,山东,山东省临沂市费县北部（距费县县城约25公里）,284,"118.090694,35.480019"
聊斋城,山东,山东省淄博市淄川区洪山镇蒲家庄,8,"118.019872,36.63417"
成山头,山东,山东省威海市荣成市西霞口村成山头风景区,168,"122.703612,37.416592"
日照海洋公园,山东,山东省日照市东港区碧海路185号（万平口四号门路西）,566,"119.613964,35.486225"
枣庄抱犊崮,山东,山东省枣庄市山亭区北庄镇抱犊崮国家森林公园,26,"117.722485,34.990148"
泰山花海,山东,山东省泰安市岱岳区满庄镇天颐湖旅游度假区,216,"117.117374,36.073533"
孟良崮,山东,山东省临沂市蒙阴县垛庄镇泉桥村孟良崮景区,118,"118.192291,35.542895"
百脉泉公园,山东,山东省济南市章丘市汇泉路31号,124,"117.544929,36.724999"
青岛世博园,山东,山东省青岛市李沧区世园大道（长水路）,154,"120.50083,36.196819"
烟台牟氏庄园,山东,山东省烟台市栖霞市霞光路庄园南街6号,100,"120.840358,37.325902"
仰口游览区,山东,山东省青岛市崂山区仰口风景游览区,426,"120.672997,36.242339"
威海汤泊温泉,山东,山东省威海市文登市经技开发区止马岭,54,"122.109578,37.264617"
八大关,山东,山东省青岛市市南区正阳关路14号,160,"120.357133,36.05803"
齐山,山东,山东省淄博市淄川区太河镇政府南5公里,136,"118.1932,36.521416"
日照河山风景区,山东,山东省日照市东港区河山镇,28,"119.477784,35.533803"
欧乐堡梦幻世界,山东,山东省烟台蓬莱市海市路三仙山大酒店对面路南,94,"120.796501,37.821267"
烟台塔山,山东,山东省烟台市芝罘区塔山路36号,144,"121.411569,37.516352"
万平口海滨风景区,山东,山东省日照市东港区海曲东路398号,38,"119.568811,35.413666"
周村古商城,山东,山东省淄博市周村区周村大街296号,290,"117.848444,36.807"
龙门石窟,河南,河南省洛阳市洛龙区龙门中街13号,4117,"112.479566,34.564212"
中国国花园,河南,河南省洛阳市洛龙区,1606,"112.454952,34.654965"
隋唐城遗址植物园,河南,河南省洛阳市洛龙区王城大桥南,596,"112.453609,34.642185"
清明上河园,河南,河南省开封市龙亭区龙亭西路5号,1380,"114.346802,34.814867"
少林寺,河南,河南省郑州登封市西北13公里嵩山南麓,1272,"112.948713,34.512389"
国家牡丹园,河南,河南省洛阳市西工区洛阳市机场路与310国道交汇口西2000米,346,"112.405246,34.713601"
古柏渡飞黄风景区,河南,河南省郑州市荥阳市王村镇,290,"113.283446,34.88561"
王城公园,河南,河南省洛阳市西工区中州中路312号,32,"112.427611,34.672791"
洛阳郁金香牡丹园,河南,河南省洛阳市孟津县机场路与小浪底专线交汇处,24,"112.373148,34.734732"
国际牡丹园,河南,河南省洛阳市王城大道北端机场西路1号,80,"112.425309,34.730568"
老君山景区,河南,河南省洛阳市栾川县城东,7937,"111.653834,33.762504"
郑州方特欢乐世界,河南,河南省郑州市中牟县郑开大道与人文路交汇口以南,760,"113.935591,34.766816"
神州牡丹园,河南,河南省洛阳市洛龙区白马寺镇白马寺对面,70,"112.613076,34.725365"
龙亭公园,河南,河南省开封市龙亭区宋都御街北街,790,"114.359797,34.814381"
云台山,河南,河南省焦作市修武县修武正北30公里方庄（靠近233省道）,260,"113.433752,35.426392"
银基动物王国,河南,郑州新密市刘寨镇银基国际旅游度假区内,1394,"0.0,0.0"
宝泉,河南,河南省新乡市辉县薄壁镇,638,"113.438532,35.482666"
隋唐洛阳城明堂天堂景区,河南,河南省洛阳市老城区中州中路与定鼎路交叉口处,734,"112.464474,34.686965"
开封府,河南,河南省开封市包公东湖北岸,662,"114.353429,34.796032"
郑州绿博园,河南,河南省郑州市中牟县郑开大道与人文路交汇向南1000米,502,"113.935892,34.765578"
八里沟,河南,河南省新乡辉县市上八里镇松树坪村,298,"113.538498,35.592382"
建业•华谊兄弟电影小镇,河南,河南省郑州市郑开大道建业·华谊兄弟电影小镇,882,"114.005192,34.781577"
红旗渠,河南,河南省安阳市林州市任村镇太行路225号,272,"113.824362,36.237878"
芒砀山旅游区,河南,河南省永城市芒山镇芒砀山景区,18,"116.494404,34.182804"
龙潭大峡谷,河南,河南省洛阳市新安县石井镇龙潭沟村,80,"112.022289,34.980692"
重渡沟,河南,河南省洛阳市栾川县潭头镇重渡村,22,"111.73909,33.953824"
大相国寺,河南,河南省开封市龙亭区自由西段36号,740,"114.360997,34.79778"
郑州园博园,河南,河南省郑州市航空港实验区,422,"113.8755,34.465428"
郑州海洋馆,河南,河南省郑州市金水区文化路与国基路交口向西100米,568,"113.664204,34.825894"
太行大峡谷,河南,河南省安阳林州市石板岩乡,158,"113.755846,36.183597"
洛阳白马寺,河南,河南省洛阳市洛龙区白马寺镇310国道,268,"112.609473,34.726745"
二郎山,河南,河南省平顶山舞钢市石漫滩水库南岸,10,"113.577752,33.282856"
嵩山,河南,河南省郑州登封市中岳大街146号,156,"113.01488,34.523706"
康百万庄园,河南,河南省巩义市康店镇庄园路59号,196,"112.957185,34.76884"
神农山,河南,河南省沁阳市西北23公里处的太行山南麓,130,"112.82462,35.213855"
七峰山生态旅游区,河南,河南南阳方城县杨集乡大河口村,108,"112.9547,33.412215"
丰乐樱花园,河南,河南省郑州荥阳连霍高速上街虎牢关下沿石化路向北2500米,588,"113.273045,34.892275"
鸡冠洞,河南,河南省洛阳市栾川县栾川县城西三公里处,166,"111.578088,33.790371"
五彩大地观光休闲旅游区,河南,河南省许昌市鄢陵县花海大道与花溪大道交汇处向西200米路北，黄龙店村西部,82,"114.184009,34.110029"
洛阳白云山度假区,河南,河南省洛阳市嵩县车村镇,216,"111.875065,33.675221"
尧山,河南,河南省平顶山市鲁山县尧山镇西竹园村,74,"112.307895,33.7352"
西峡恐龙遗迹园,河南,河南省南阳市西峡县丹水镇三里庙村,114,"111.692795,33.23493"
银基冰雪世界,河南,河南省郑州市新密市刘寨镇银基国际旅游度假区,452,"113.561087,34.486188"
殷墟,河南,河南省安阳市西北郊小屯村,234,"114.315893,36.148167"
包公祠,河南,河南省开封市鼓楼区向阳路1号,262,"114.345583,34.799117"
灯台架,河南,河南省平顶山舞钢市杨庄乡,48,"113.563752,33.19965"
青天河,河南,河南省焦作市博爱县青南路青天河风景名胜区,80,"112.995079,35.320716"
金鹭鸵鸟乐园,河南,新郑市好想你大道6号（直接导航好想你金鹭鸵鸟园即可）,26,"113.826521,34.56379"
黛眉山,河南,河南省洛阳市新安县石井镇,22,"111.981262,35.043102"
郑州黄河文化公园,河南,河南省郑州市江山路黄河南1号,188,"113.523323,34.95988"
嵖岈山,河南,河南省驻马店遂平县嵖岈山风景名胜区,246,"113.744014,33.13333"
周口野生动物世界,河南,周口市川汇区城北中州路北段,816,"114.639221,33.687092"
花都温泉度假村,河南,河南省许昌市鄢陵县陈化店镇,18,"114.072943,34.083521"
开封汴京公园动物园,河南,河南省开封市顺河回族区汴京路汴京公园内动物园,16,"114.377178,34.802488"
嘉应观,河南,河南省焦作市武陟县城东南12公里杨庄村南,20,"113.516203,35.043331"
万岁山•大宋武侠城,河南,河南省开封市龙亭区东京大道中段,148,"114.35276,34.825924"
南湾湖,河南,河南省信阳市南湖大街188号,326,"114.011529,32.131712"
金顶山,河南,河南省驻马店确山县蚁峰镇,64,"113.841521,32.876102"
周王城天子驾六博物馆,河南,河南省洛阳市西工区中州中路226号,122,"112.449771,34.680019"
郑州动物园,河南,河南省郑州市金水区花园路103号,12,"113.691205,34.794729"
老乐山,河南,河南省驻马店市确山县,98,"114.032867,32.807897"
古灵山,河南,河南省鹤壁市淇县县城西北部,30,"114.130033,35.6832"
伏曦太昊陵,河南,河南周口市淮阳县羲皇故都风景名胜区,108,"114.893598,33.753932"
西九华山,河南,河南省信阳市固始县陈淋子镇西九华山风景区,66,"115.802242,31.80416"
唐韵樱花园,河南,许昌市鄢陵县陈化店镇花溪大道北路,106,"114.106887,34.146342"
老界岭,河南,河南省南阳市西峡县太平镇东平村,24,"111.521008,33.743245"
九峰山景区,河南,河南省平顶山市汝州市西南20公里处的寄料镇、蟒川镇,14,"112.6242,33.983999"
羑里城,河南,河南省安阳市汤阴县城北4公里处的羑河村东,56,"114.36214,35.960932"
函谷关,河南,河南省三门峡市灵宝市函谷关古文化旅游区,20,"110.932861,34.640351"
浮戏山雪花洞,河南,河南省郑州巩义市新中镇,22,"113.197085,34.631447"
六羊山通天河景区,河南,河南省平顶山市鲁山县尧山镇境内,6,"112.469094,33.714688"
七十二潭景区,河南,河南省南阳市方城县境内,20,"112.95892,33.417805"
嵩阳书院,河南,河南省郑州登封市中岳大街146号嵩山风景区内,102,"113.040152,34.485943"
淅川县八仙洞景区,河南,河南省南阳市淅川县马蹬镇余沟村,12,"111.5523,32.871147"
中国翰园,河南,河南省开封市龙亭区龙亭北路15号,26,"114.35116,34.816107"
黄鹤楼,湖北,武汉市武昌区蛇山西山坡特1号,3876,"114.309043,30.550317"
户部巷,湖北,湖北省武汉市武昌区自由路,1132,"114.30429,30.552322"
武汉杜莎夫人蜡像馆,湖北,武汉市武昌区东湖和沙湖之间楚河汉街021号,54,"114.350673,30.561448"
中国唐城,湖北,湖北省襄阳市襄城区向阳路十家庙村4组,1200,"112.186472,31.992565"
武汉海昌极地海洋公园,湖北,湖北省武汉市东西湖区金银潭大道96号,1100,"114.285587,30.669357"
武汉欢乐谷,湖北,湖北省武汉市青山区欢乐大道196号,602,"114.400312,30.599848"
云雾山,湖北,湖北省武汉市黄陂区泡桐店境内,376,"114.220245,31.130991"
恩施大峡谷,湖北,湖北省恩施市西北部沐抚办事处境内,602,"109.201238,30.411298"
武当山,湖北,湖北省十堰市丹江口市武当山景区,602,"111.102943,32.511746"
梭布垭石林,湖北,湖北省恩施市太阳河乡石林村,60,"109.582529,30.577052"
三峡人家,湖北,宜昌市夷陵区峡州路5号,420,"111.170932,30.805222"
木兰草原,湖北,湖北省武汉市黄陂区王家河镇聂家岗,398,"114.469899,30.967081"
木兰天池,湖北,湖北省武汉市黄陂区木兰天池游客中心,362,"114.291652,31.183832"
龟峰山,湖北,湖北省黄冈麻城市龟峰山村,148,"115.248695,31.0979"
武汉东湖磨山,湖北,湖北省武汉市洪山区磨山景区内。,72,"114.424627,30.556117"
湖北省博物馆,湖北,湖北省武汉市武昌区东湖路156号,248,"114.371479,30.568385"
东西湖郁金香主题公园,湖北,武汉市东西湖区吴新干线626号（吴新干线9.1公里处）,60,"114.094998,30.712277"
神农架国际生态旅游区,湖北,湖北省直辖县级行政单位神农架林区,28,"110.409188,31.458971"
古隆中,湖北,湖北省襄阳襄城区隆中路461号,228,"112.041845,31.99698"
清江画廊,湖北,湖北省宜昌市长阳县龙舟坪镇晒鼓坪村,90,"111.146829,30.469896"
武汉东湖风景区,湖北,湖北省武汉市武昌区,212,"114.379627,30.575498"
中国汉城,湖北,湖北省襄阳市枣阳市汉城大道,78,"112.789226,32.122237"
东湖樱园,湖北,湖北省武汉市武昌区东湖风景区内,1828,"114.41590775643,30.550663586483"
武汉花博汇,湖北,武汉市蔡甸区大集街道知音湖大道天星村1号,800,"114.085172,30.494344"
神农架,湖北,湖北省神农架林区境内,32,"110.697405,31.749038"
武汉植物园,湖北,湖北省武汉市洪山区鲁磨路特1号,330,"114.429279,30.550832"
西游记公园,湖北,湖北省随州市曾都区大洪山镇温泉村,106,"112.873166,31.624662"
东湖海洋世界,湖北,湖北省武汉市武昌区沿湖大道20号（东湖梨园旁）,332,"114.386882,30.579718"
三峡大坝旅游区,湖北,湖北省宜昌市夷陵区三斗坪镇,86,"111.059414,30.841024"
五道峡,湖北,湖北省襄阳市保康县五道峡,48,"111.234258,31.730112"
三峡湿地•杨守敬书院风景名胜区,湖北,湖北省宜都市五眼泉镇石门村二组,4,"111.336805,30.385717"
腾龙洞,湖北,恩施土家族苗族自治州利川市腾龙大道1号,62,"108.992579,30.335537"
锦里沟,湖北,湖北省武汉市黄陂区蔡店乡道士冲村,106,"114.238967,31.279625"
薄刀峰,湖北,湖北黄冈市罗田县大别山薄刀峰风景区,34,"115.57213,31.112264"
