names,province,addresses,counts,points
恭王府,北京,北京市西城区什刹海前海西街17号,4034,"116.393097,39.942341"
八达岭长城,北京,北京市延庆县军都山关沟古道北口216省道附近,6910,"116.03293,40.369733"
颐和园,北京,北京市海淀区新建宫门路19号,8234,"116.276887,39.999497"
天坛公园,北京,北京市东城区天坛内东里7号,3750,"116.417313,39.887976"
故宫,北京,北京市东城区景山前街4号,12018,"116.403347,39.922148"
圆明园,北京,北京市海淀区清华西路28号,3374,"116.314607,40.01629"
鸟巢,北京,北京市朝阳区国家体育场南路1号奥林匹克公园内,2429,"116.404487,40.000484"
中国国家博物馆,北京,北京东城区东长安街16号天安门广场东侧,1964,"116.40066,39.90536"
明十三陵,北京,北京市昌平区十三陵特区,470,"116.234094,40.300017"
毛主席纪念堂,北京,北京市东城区天安门广场人民英雄纪念碑南面,1028,"116.404158,39.909201"
天安门广场,北京,北京市东城区天安门,1656,"116.404015,39.912729"
清华大学,北京,北京市海淀区双清路30号,492,"116.332498,39.996652"
北海公园,北京,北京市西城区文津街1号（故宫北）,1574,"116.398222,39.939528"
中国人民革命军事博物馆,北京,北京市海淀区复兴路9号,706,"116.330745,39.915462"
景山公园,北京,北京市西城区景山西街44号,606,"116.40302,39.932031"
八达岭长城缆车,北京,北京市延庆县军都山关沟古道北口八达岭长城景区内,1134,"116.020213,40.367229"
纪晓岚故居,北京,北京市西城区（原宣武区）珠市口西大街241号,380,"116.393596,39.896121"
北京动物园,北京,北京市西城区西直门外大街137号,3666,"116.34331,39.947983"
水立方,北京,北京市朝阳区天辰东路11号奥林匹克公园内,370,"116.396015,39.999061"
中国科学技术馆,北京,北京市朝阳区北辰东路5号,1040,"116.405132,40.012256"
慕田峪长城,北京,北京市怀柔区慕田峪村,1094,"116.57035,40.437612"
雍和宫,北京,北京市雍和宫大街12号,768,"116.423433,39.954954"
北京知青旧居,北京,陕西省延安市宜川县羊家庄,108,"110.417031,36.196232"
北京大学,北京,北京市海淀区颐和园路5号,230,"116.316176,39.997741"
奥林匹克公园,北京,北京市朝阳区天辰东路11号,252,"116.39611,39.994915"
定陵,北京,北京市昌平区十三陵特区明十三陵,186,"116.233071,40.30027"
北京园博园,北京,北京市丰台区永定河畔,846,"116.195753,39.88455"
居庸关长城,北京,北京市昌平区南口镇居庸关长城,518,"116.081732,40.295477"
香山公园,北京,北京市海淀区买卖街40号,246,"116.203098,39.996942"
故宫讲解,北京,北京市东城区景山前街4号故宫博物院内,128,"116.403438,39.924455"
中国国家大剧院,北京,北京市西城区西长安街2号,158,"116.396436,39.913224"
玉渊潭公园,北京,北京市海淀区西三环中路10号,2928,"116.32638,39.922645"
什刹海,北京,北京市西城区羊房胡同,82,"116.390595,39.949373"
北京海洋馆,北京,北京市海淀区高粱桥斜街乙18号,1628,"116.347505,39.95032"
北京杜莎夫人蜡像馆,北京,北京市东城区前门大街8号,150,"116.404547,39.903732"
故宫博物馆,北京,天安门广场北侧,70,"0.0,0.0"
珍宝馆,北京,北京市东城区景山前街4号,198,"116.403413,39.921947"
中央电视塔,北京,北京市海淀区西三环中路11号,276,"116.312768,39.925467"
天安门城楼,北京,北京市东城区天安门院内西侧,54,"116.403857,39.915291"
圣泉山,北京,北京市怀柔区桥梓镇口头村,24,"116.588333,40.371208"
宋庆龄故居,北京,北京市西城区后海北沿西端46号,112,"116.389564,39.951738"
中山公园,北京,北京市东城区天安门广场中华路4号,62,"116.400754,39.916998"
前门大街,北京,北京市东城区（原崇文区）前门,12,"116.40441051109,39.903750211675"
北京欢乐谷,北京,北京市朝阳区东四环小武基北路,1216,"116.500803,39.873539"
故宫礼物,北京,北京市故宫内坤宁宫东基化门南侧故宫文化产品专卖店,74,"116.403245,39.92711"
南锣鼓巷,北京,北京市东城区南锣鼓巷117号,30,"116.409192,39.939808"
北京大观园,北京,北京市西城区（原宣武区）南菜园街12号,222,"116.362798,39.876875"
司马台长城,北京,北京市密云县东北部的古北口镇境内,424,"117.284641,40.660322"
北京刘老根大舞台,北京,北京市东城区前门东路小江胡同34至36号阳平会馆近前门大街,18,"116.406547,39.89974"
古北口长城,北京,北京市密云县古北口镇,186,"117.172205,40.689651"
世界公园,北京,北京市丰台区花乡丰葆路158号,552,"116.2937,39.816749"
慕田峪长城箱式索道,北京,北京市怀柔区渤海镇慕田峪村,74,"116.57035,40.437612"
孔庙,北京,北京市东城区国子监街13号,14,"116.421431,39.95234"
北京自然博物馆,北京,北京市东城区（原崇文区）天桥南大街126号,420,"116.401417,39.883321"
红砖美术馆,北京,北京市朝阳区崔各庄乡何各庄,70,"116.505686,40.048368"
人民英雄纪念碑,北京,北京市天安门广场中央,34,"116.40406464993,39.910944090549"
北京植物园,北京,北京市海淀区卧佛寺路,632,"116.216945,40.008988"
北京野生动物园,北京,北京市大兴区一零六国道,6694,"116.342645,39.50183"
明皇蜡像宫,北京,北京市昌平区西关镇西关环岛西北侧,14,"116.220593,40.231612"
北京汽车博物馆,北京,北京市丰台区南四环西路126号,526,"116.308106,39.835053"
奥林匹克塔,北京,北京市朝阳区北五环仰山桥西1200米,100,"116.399387,40.014739"
古北水镇,北京,北京市密云县古北口镇司马台村古北水镇,2051,"117.267356,40.650895"
北京天文馆,北京,北京市西城区西直门外大街138号,96,"116.343208,39.943273"
永顺染坊,北京,北京市密云县密云区染坊胡同001号,12,"117.278446,40.654349"
孔庙和国子监博物馆,北京,北京市东城区安定门内国子监街13号,24,"116.419671,39.953084"
响水湖长城旅游风景区,北京,北京市怀柔区响水湖长城旅游风景区,46,"116.468702,40.46273"
中国人民抗日战争纪念馆,北京,北京市丰台区卢沟桥宛平城内街101号,6,"116.232485,39.857906"
中国古动物馆,北京,北京市西城区西直门外大街142号,12,"116.340657,39.943386"
云梦仙境,北京,北京市怀柔区琉璃庙镇东峪村云梦仙境自然风景区,31,"116.701717,40.626245"
王府井商业街,北京,北京市东城区东长安街北侧,2,"116.417797,39.916953"
国子监,北京,北京市东城区安定门内国子监街13号,32,"116.420453,39.952927"
世界花卉大观园,北京,北京市丰台区南四环中路235号,690,"116.359809,39.841719"
北京独角兽星空艺术馆,北京,北京市东城区王府井大街88号银泰in88二层,46,"116.418482,39.922232"
古北水镇天然温泉,北京,北京市密云县古北口镇司马台村古北水镇内,54,"117.280627,40.659778"
古北水镇司马台新村山水城,北京,密云区司马台新村古北水镇司马台新村63号-1山水城（古北口镇）,34,"117.170492,40.697861"
天津古文化街,天津,天津市南开区通北路与东马路交口附近,412,"117.198268,39.149537"
塘沽外滩游船,天津,天津市滨海新区塘沽海昌商业街17号楼对面游船码头,166,"117.670044,39.017552"
天津之眼摩天轮,天津,天津市河北区三岔河口永乐桥上,104,"117.193805,39.160233"
意式风情街,天津,天津市河北区光复道8号,124,"117.206871,39.140884"
五大道,天津,天津市和平区睦南道,140,"117.20394,39.116079"
天津泰达航母主题公园,天津,天津市滨海新区汉沽汉北路269号,410,"117.815028,39.162205"
庆王府,天津,天津市和平区重庆道55号庆王府院内(近民园体育场),258,"117.214351,39.119385"
瓷房子,天津,天津市和平区赤峰道72号,92,"117.202575,39.124825"
海河游船,天津,天津市南开区古文化街码头,536,"117.201171,39.15063"
张学良故居,天津,天津市和平区赤峰道78号,86,"117.208211,39.129784"
海河外滩公园,天津,天津市滨海新区海河外滩公园,8,"117.670957,39.021379"
天津海昌极地海洋公园,天津,天津市滨海新区响螺湾中心商务区61号,1762,"117.668338,39.01374"
古文化街燕乐升萍相声茶馆,天津,天津市南开区古文化街美食街二楼99-4号,6,"117.199764,39.147895"
大悲禅院,天津,天津市河北区天纬路中段东北侧,10,"117.188943,39.156246"
天津欢乐谷,天津,天津市东丽区东丽湖旅游度假区东丽之光大道,748,"117.48083,39.193173"
静园-末代皇帝溥仪旧居,天津,天津市和平区鞍山道70号,4,"117.195893,39.128964"
张园,天津,天津和平区鞍山道59号,34,"117.20457213713,39.13652060648"
天津鼓楼天街茶馆相声帮,天津,天津市南开区盛津园29号楼006 天街茶馆（城厢中路台湾菜馆后身）,82,"117.182935,39.146773"
鼓楼,天津,天津市南开区城厢中路,16,"117.187836,39.147399"
杨柳青古镇,天津,天津市西青区杨柳青古镇景区,112,"117.021442,39.134669"
南市食品街,天津,天津市和平区南市商业圈,2,"117.191246,39.138647"
南开大学,天津,天津市南开区卫津路94号,67,"117.185475,39.109076"
洋货市场,天津,天津市滨海新区洋货步行街,4,"117.663466,39.034703"
天津方特欢乐世界,天津,天津市滨海新区中新生态城中生大道北首生态岛内,378,"117.743299,39.159433"
五大道之马场道,天津,天津市河西区津港路4号,34,"117.206525,39.110549"
天津盘山风景名胜区,天津,天津市蓟县官庄镇北15公里处,708,"117.286958,40.100119"
中华曲苑,天津,天津市和平区南市大街和清河大街交口,65,"117.19702219271,39.144464605209"
精武门·中华武林园,天津,天津市西青区精武镇小南河村,4,"117.141643,39.034742"
天津博物馆,天津,天津市河西区友谊路31号　　,6,"117.218032,39.091611"
海河公园,天津,天津市和平区台儿庄路,22,"117.218779,39.136942"
静园-末代皇帝溥仪旧居,天津,天津市和平区鞍山道70号,4,"117.195893,39.128964"
张园,天津,天津和平区鞍山道59号,34,"117.20457213713,39.13652060648"
天津鼓楼天街茶馆相声帮,天津,天津市南开区盛津园29号楼006 天街茶馆（城厢中路台湾菜馆后身）,82,"117.182935,39.146773"
鼓楼,天津,天津市南开区城厢中路,16,"117.187836,39.147399"
杨柳青古镇,天津,天津市西青区杨柳青古镇景区,112,"117.021442,39.134669"
南市食品街,天津,天津市和平区南市商业圈,2,"117.191246,39.138647"
南开大学,天津,天津市南开区卫津路94号,67,"117.185475,39.109076"
洋货市场,天津,天津市滨海新区洋货步行街,4,"117.663466,39.034703"
天津方特欢乐世界,天津,天津市滨海新区中新生态城中生大道北首生态岛内,378,"117.743299,39.159433"
五大道之马场道,天津,天津市河西区津港路4号,34,"117.206525,39.110549"
天津盘山风景名胜区,天津,天津市蓟县官庄镇北15公里处,708,"117.286958,40.100119"
中华曲苑,天津,天津市和平区南市大街和清河大街交口,65,"117.19702219271,39.144464605209"
精武门·中华武林园,天津,天津市西青区精武镇小南河村,4,"117.141643,39.034742"
天津博物馆,天津,天津市河西区友谊路31号　　,6,"117.218032,39.091611"
海河公园,天津,天津市和平区台儿庄路,22,"117.218779,39.136942"
秀水蓝湾温泉酒店,天津,天津市西青区李七庄街秀川路8号A区,2,"117.15537,39.076038"
Funland凡乐莱蹦床公园,天津,天津市南开区黄河道519号(盛名集团工业园内),34,"117.127278,39.145897"
石家大院,天津,天津市西青区杨柳青镇估衣街47号,282,"117.017172,39.14089"
独乐寺,天津,天津市蓟县城内武定街41号,108,"117.410073,40.05099"
天津武清绿博园,天津,天津市武清区下朱庄南湖景区,42,"117.137601,39.341076"
霍元甲纪念馆,天津,天津市西青区南河镇小南河村（小南河中心小学附近）,66,"117.141349,39.035113"
尔宝瑞蜡像馆,天津,天津市河北区民生路89号,54,"117.207256,39.139199"
天津自然博物馆,天津,天津市河西区马场道206号,2,"117.191948,39.095879"
天津水上公园,天津,天津市南开区水上公园北路33号,4,"117.168253,39.088427"
天津小站练兵园,天津,天津市津南区小站镇小站练兵园,2,"117.437355,38.925904"
京津佛罗伦萨小镇,天津,天津市武清区前进道北侧 （距北京/天津城际铁路武清站前100米）,154,"117.022894,39.382314"
东方之珠洗浴（武清店）,天津,天津市武清区中信广场A座8号,4,"117.078012,39.374587"
乐汤汇温泉生活馆,天津,天津市河东区十三经路与津塘路交汇处（原津华圣派）,36,"117.239119,39.127593"
仁爱团泊湖温泉中心,天津,天津市静海县团泊新城团泊湖庭院,36,"117.163499,38.911271"
盘山塔林,天津,天津市蓟县盘山风景区内,8,"117.271143,40.096476"
宝成奇石园,天津,天津市津南区双桥河镇宝成新村海河二道闸南,33,"117.468312,39.024399"
宁园,天津,天津市河北区中山北路1号,46,"117.220952,39.17552"
天津亿利生态精灵乐园,天津,天津市滨海新区中新生态城,176,"117.742026,39.150071"
二南开中学游泳馆,天津,天津市和平区荣安大街167号(近第二南开中学),4,"117.189375,39.134512"
天后宫,天津,天津市南开区古文化街80号,76,"117.190922,39.143526"
广东会馆,天津,天津市南开区鼓楼东街257号,32,"117.18125,39.142103"
金美达龙泽水汇戏水乐园,天津,天津静海区大邱庄镇崔庄子金美达大酒店,55,"117.036694,38.8619"
国家海洋博物馆,天津,天津市滨海新区海轩道377号,44,"117.801768,39.112442"
天津观光巴士津游1号(观光5路),天津,天津市和平区津湾广场站内松江路津湾广场站,8,"117.216933,39.138722"
天津高空跳伞,天津,天津市滨海新区大港太平镇窦庄子村,45,"117.339917,38.588744"
江山温泉,天津,天津市河西区梅林路与陵水道交口24号,45,"117.261043,39.066766"
曙光水镇,天津,天津市北辰区永定新河与龙凤河交汇处,98,"117.347237,39.299549"
水澜湾汤泉洗浴,天津,天津市南开区咸阳路100号（近自贡路）,87,"117.1445,39.131342"
天津清湖洗浴,天津,天津市南开区西湖道卧龙东里1号楼旁,35,"117.162077,39.125753"
民园体育场,天津,天津市和平区重庆道83号,50,"117.21804426424,39.124828200703"
秦皇岛野生动物园,河北,河北省秦皇岛市北戴河区滨海大道中段,868,"119.527456,39.873205"
汉牡丹园景区,河北,河北省邢台市柏乡县北郝村,38,"114.719221,37.538248"
苍岩山,河北,河北省石家庄市井陉县苍岩山镇,66,"114.152012,37.836782"
石家庄植物园,河北,河北省新华区植物园街60号,52,"114.387244,38.115057"
碧螺塔海上酒吧公园,河北,河北省秦皇岛市北戴河区东海滩路中段(近鸽子窝公园),284,"119.54357,39.827324"
鸽子窝公园,河北,河北省秦皇岛市北戴河区海滨东北角鸽赤路,280,"119.533165,39.842702"
避暑山庄,河北,河北省承德市双桥区丽正门大街20号,208,"117.940068,41.002781"
白石山世界地质公园,河北,河北省保定市涞源县城南15公里处白石山景区,102,"114.689055,39.236145"
新澳海底世界,河北,河北省秦皇岛市海港区河滨路81号,280,"119.568995,39.912052"
娲皇宫,河北,河北省邯郸市涉县索堡镇,44,"113.629833,36.649967"
野三坡百里峡,河北,河北省保定市涞水县野三坡镇苟各庄村,34,"115.392307,39.672927"
太行水镇,河北,河北省保定市易县安格庄乡,38,"115.24968,39.293775"
邯郸方特国色春秋,河北,邯郸市中华慈大街18号,106,"114.400228,36.29037"
野三坡,河北,河北省保定市涞水县三坡镇,50,"115.391843,39.674643"
石家庄抱犊寨,河北,河北省石家庄市西16公里处的鹿泉市获鹿县城西,72,"114.347321,38.084703"
红石沟生态休闲农场,河北,河北省邢台市沙河市白塔镇张下曹村,4,"114.251792,36.922392"
曲阳虎山风景区,河北,河北省保定市曲阳县范家庄乡虎山村,102,"114.570326,38.937032"
龙山蜡像馆景区,河北,河北省石家庄市鹿泉区龙山蜡像馆景区（导航直接搜索）,6,"114.25052,38.225284"
金山岭长城,河北,河北承德滦平县巴克什营,22,"117.25213,40.692652"
黄金海岸,河北,河北省秦皇岛市昌黎县黄金海岸,10,"119.346162,39.702563"
广府古城,河北,河北省邯郸市永年县广府镇,16,"114.732236,36.703348"
狼牙山,河北,河北省保定市易县狼牙山镇东西水村,148,"115.18275,39.149357"
腰山王氏庄园,河北,河北省保定市顺平县腰山镇南腰山村,12,"115.200273,38.902945"
京娘湖,河北,河北省邯郸武安市京娘湖,134,"113.960493,36.894683"
北戴河集发梦想王国,河北,河北省秦皇岛市北戴河海北路中段,210,"119.424705,39.826558"
北戴河,河北,河北省秦皇岛北戴河区北戴河,86,"119.491161,39.840984"
沕沕水,河北,河北省石家庄市平山县北冶乡沕沕水生态风景区,24,"113.770474,38.208039"
满城汉墓,河北,河北省保定市满城县中山西路,118,"115.307398,38.955251"
赵州桥,河北,河北省石家庄市赵县,234,"114.775583,37.728641"
石家庄动物园,河北,河北省鹿泉市获鹿镇杜家庄村西北侧,206,"114.314984,38.07516"
清东陵,河北,河北省唐山市遵化市西北30公里处,62,"117.712436,40.136521"
九龙峡自然风光旅游区,河北,河北省邢台市邢台县浆水镇营房台村,106,"113.882782,37.206745"
太行五指山,河北,河北省邯郸市涉县河南店镇南庄村,26,"113.658153,36.529188"
荣国府,河北,河北省石家庄市正定县兴荣路51号,8,"114.585705,38.153502"
山海关老龙头景区,河北,河北省秦皇岛市山海关区龙海大道1号,174,"119.805028,39.975207"
吴桥杂技大世界,河北,河北省沧州市吴桥县京福路1号,228,"116.392857,37.647157"
白鹿温泉,河北,河北省石家庄市平山县温塘镇白鹿温泉景区（近白鹿大道）,26,"113.987737,38.256266"
国御温泉度假小镇,河北,河北省石家庄藁城市藁新路6号,4,"114.766889,38.036547"
云蒙山皇家森林公园,河北,河北省保定市易县云蒙山皇家森林公园,6,"115.273256,39.404772"
青龙山,河北,河北省唐山滦县新城西北约25公里,40,"118.476348,39.844336"
天下第一关（山海关）,河北,河北省秦皇岛市山海关区东头条胡同,162,"119.768109,40.012102"
清西陵,河北,河北省保定市易县县城西15公里处的永宁山下,64,"115.352505,39.355767"
金丰农科园,河北,河北省廊坊市广阳区和平路北端,12,"116.726466,39.589389"
秦王湖,河北,河北省邢台市沙河市,8,"114.128859,36.972515"
普陀宗乘之庙,河北,河北省承德市双桥区狮子沟北侧,50,"117.955153,41.013316"
易水湖,河北,河北省保定市易县安格庄乡,390,"115.236594,39.289527"
泥河湾温泉水世界,河北,河北省张家口市阳原县三马坊乡澡洗塘村,6,"114.593423,40.218207"
天河山（中国爱情山）,河北,河北省邢台市邢台县白岸乡清泉村,22,"113.804379,37.093472"
正定隆兴寺（大佛寺）,河北,河北省石家庄市正定县中山东路109号,124,"114.588945,38.148799"
山叶口景区,河北,河北省唐山迁安市西部大五里乡山叶口村,166,"118.533652,39.990007"
石家庄海悦天地海洋公园,河北,河北省石家庄市桥西区裕华西路66号海悦天地负一层,176,"114.481105,38.041159"
衡水野生动物园,河北,衡水市武邑县X905县道（武罗小学南500米）,192,"0.0,0.0"
古莲花池,河北,河北省保定市南市区裕华西路160号,4,"115.50574,38.862805"
岐山湖景区,河北,河北省邢台市临城县,102,"114.444084,37.467255"
大浪淘沙假日酒店,河北,河北省石家庄市谈固南大街槐安路交汇处南300米路东,8,"114.570112,38.024971"
崆山白云洞,河北,河北省邢台市临城县西竖镇山南头村西,32,"114.443873,37.461347"
渔岛,河北,河北省秦皇岛市昌黎县北戴河新区赤洋口片区滨海新大道D4段东侧渔岛景区,50,"119.291655,39.611474"
辛玛王国主题乐园,河北,河北省石家庄鹿泉市向阳南大街石家庄市动物园《辛玛王国》,70,"114.31478,38.073534"
遵化汤泉宫温泉度假村,河北,唐山市遵化市汤泉乡汤泉村乡政府西侧100米,4,"117.771422,40.206435"
鸡鸣山,河北,河北省张家口市下花园区鸣山路南,32,"115.310407,40.480677"
南和农业嘉年华,河北,河北省邢台市南和县贾宋镇325省道与中兴东大街交叉口旁,22,"114.727483,37.074342"
开滦国家矿山公园,河北,河北省唐山市路北区新华东道54号,38,"118.205349,39.628836"
北响堂山石窟,河北,河北省邯郸市峰峰矿区鼓山,28,"114.167592,36.539243"
普宁寺,河北,河北省承德市双桥区普宁路1号,44,"117.958959,41.022896"
黄帝城,河北,河北省张家口市涿鹿县矾山镇水磨村西,8,"115.422161,40.227185"
东太行景区,河北,河北省邯郸市武安市活水乡202省道北台上村东南方向,50,"113.911083,36.935035"
朝阳沟,河北,河北省邯郸武安市馆陶县列江村,22,"113.816601,36.923568"
云梦山,河北,河北省邢台市邢台县冀家村乡石板房村北,64,"113.935471,37.333721"
绿溪谷乐园,河北,河北省保定市阳光北大街植物园北门,28,"115.487434,38.928451"
邢台大峡谷,河北,河北省邢台市邢台县西70公里处,8,"113.82973,37.144809"
天梯山,河北,河北省邢台县西黄村镇东牛庄,36,"114.26138,37.111217"
神农现代农业示范园,河北,河北省保定市徐水区长城北大街4678号,32,"115.590094,38.967955"
塔寺峪景区,河北,河北省唐山市迁安市大五里乡上庄子村,8,"118.87795,39.97453"
窦王岭游乐场,河北,河北省石家庄市井陉县吴家窑乡衡井线窦王岭附近,36,"114.297055,37.950018"
兴隆山景区,河北,河北省承德市兴隆县白马川（白马川高速出口右转1公里）,124,"118.063504,40.758925"
五台山,山西,山西省忻州市五台县台怀镇,2346,"113.596375,38.984397"
平遥古城,山西,山西省晋中市平遥县,1594,"112.190081,37.21041"
云冈石窟,山西,山西省大同市城西约16公里的武州山南麓,914,"113.139454,40.117323"
乔家大院,山西,山西省晋中市祁县乔家堡村,1274,"112.44405,37.41108"
王家大院,山西,山西省晋中市灵石县静升镇静升村,1088,"111.881551,36.902417"
皇城相府,山西,山西省晋城市阳城县北留镇皇城村,164,"112.588586,35.519979"
太行山大峡谷,山西,山西省壶关县桥上乡,44,"113.470193,35.948267"
蟒河生态旅游区,山西,山西省晋城市阳城县蟒河镇蟒河村,12,"112.449436,35.387233"
大同方特欢乐世界,山西,山西省大同市平城区南环路南侧3666号,454,"113.376424,40.068704"
壶口瀑布,山西,山西省临汾市吉县壶口镇黄河壶口瀑布国家地质公园内,462,"110.458711,36.136265"
悬空寺,山西,山西省大同市浑源县东南郊恒山脚下,456,"113.723762,39.667706"
山西通天峡景区,山西,山西省长治市平顺县虹梯关乡梯后村通天峡景区,50,"113.605425,36.21218"
又见平遥,山西,山西省晋中市平遥县顺城路154号又见平遥剧场,508,"112.178892,37.20487"
山西晋祠博物馆,山西,山西省太原市晋源区晋祠镇,380,"112.449588,37.714882"
尧庙,山西,山西省临汾市尧都区尧庙村,34,"111.502607,36.057412"
雁门关,山西,山西省忻州代县雁门关景区（二广高速新广武出口8公里）,112,"112.894892,39.168842"
绵山,山西,山西省晋中市介休城东南20公里处新地村,58,"111.955624,36.891096"
洪洞大槐树,山西,山西省临汾市洪洞县古槐北路公园街002号,200,"111.681287,36.275181"
五爷庙,山西,山西省忻州市五台县五台山风景区,828,"113.60863542041,38.983173091396"
壶关太行八泉峡,山西,长治市壶关县桥上乡,74,"113.567300365,35.9450139565"
恒山,山西,山西省大同市浑源县恒山南路,212,"113.733277,39.668683"
太原动物园,山西,山西省太原市杏花岭区东马路2号,190,"112.574241,37.908122"
芦芽山,山西,山西省忻州市宁武县芦芽山游客服务中心,8,"112.106162,38.822836"
云丘山景区,山西,山西省临汾市乡宁县关王庙乡大河村,42,"111.042271,35.744339"
藏山风景区,山西,山西省阳泉市盂县苌池镇藏山村,38,"113.375446,38.226884"
常家庄园,山西,山西省晋中市榆次区东阳镇车辋村,102,"112.644994,37.549626"
鹳雀楼,山西,山西运城永济市蒲州古城西鹳雀楼景区,38,"110.277179,34.833102"
解州关帝庙,山西,山西省运城市解州镇西关五一路145号,120,"110.856919,34.913108"
蒙山大佛,山西,山西省太原市晋源区罗城寺底村,122,"112.45355178497,37.783053838338"
大阳古镇,山西,山西省晋城市泽州县大东线,4,"112.810553,35.671597"
华门,山西,山西省临汾市尧都区尧庙村华门景区,34,"111.494444,36.058351"
东湖醋园,山西,山西省太原市杏花岭区马道坡街26号,26,"112.60167,37.884731"
应县木塔,山西,山西省朔州市应县城内塔前街,228,"113.195365,39.571065"
菩萨顶,山西,山西省忻州市五台县五台山风景区,332,"113.601213,39.019046"
大同华严寺,山西,山西省大同市城区下寺坡街14号,46,"113.30328,40.098777"
